### ISSUE TITLE
get stuck training on multiple machines error

### ISSUE THREAD

**Issue by hhyasdf** [apache/incubator-mxnet#7924]
I try to run mxnet on 2 machines
use command under the example/image-classification/ directory :
********************
export DMLC_INTERFACE=interface_name
export DMLC_PS_ROOT_PORT=12121
export DMLC_PS_ROOT_URI='11.11.3.6'

python ../../tools/launch.py -n 2 -H hosts --sync-dst-dir /tmp/mxnet python train_mnist.py --network lenet --kv-store dist_sync
*********************

the contents of hosts file:
*********************
11.11.3.10
11.11.3.6
*********************

and when I ran htop, i did find it run on both two nodes
but it only print:

*********************

2017-09-17 07:46:42,379 INFO rsync /home/uniquesc/rdma/incubator-mxnet/example/image-classification/ -> 11.11.3.10:/tmp/mxnet                         
2017-09-17 07:46:43,837 INFO rsync /home/uniquesc/rdma/incubator-mxnet/example/image-classification/ -> 11.11.3.6:/tmp/mxnet

*********************

and did not download the data of train set, just stuck without going on

I compile mxnet with the commad:
*********************
make -j10 USE_DIST_KVSTORE=1
*********************

by adding some imformation to print in the souce code of mxnet, and ran tcpdump in both machines
I just found that they keep sending packets to each other again and again...
the tcpdump print like this:
*********************
19:37:21.818446 IP node336.ssh > node332.40246: Flags [P.], seq 541692:5418
88, ack 289, win 325, options [nop,nop,TS val 2856082226 ecr 2856082090], l
ength 196
19:37:21.818477 IP node332.40246 > node336.ssh: Flags [.], ack 541692, win 
1366, options [nop,nop,TS val 2856082090 ecr 2856082226], length 0
19:37:21.818493 IP node336.ssh > node332.40246: Flags [P.], seq 541888:5424
80, ack 289, win 325, options [nop,nop,TS val 2856082226 ecr 2856082090], l
ength 592
19:37:21.818526 IP node332.40246 > node336.ssh: Flags [.], ack 541888, win 
1365, options [nop,nop,TS val 2856082090 ecr 2856082226], length 0
19:37:21.818557 IP node336.ssh > node332.40246: Flags [P.], seq 542480:5426
60, ack 289, win 325, options [nop,nop,TS val 2856082226 ecr 2856082090], l
ength 180
19:37:21.818574 IP node332.40246 > node336.ssh: Flags [.], ack 542480, win 
1361, options [nop,nop,TS val 2856082090 ecr 2856082226], length 0
19:37:21.818584 IP node336.ssh > node332.40246: Flags [P.], seq 542660:542
56, ack 289, win 325, options [nop,nop,TS val 2856082226 ecr 2856082090], l
ength 196
19:37:21.818605 IP node336.ssh > node332.40246: Flags [P.], seq 542856:543$
36, ack 289, win 325, options [nop,nop,TS val 2856082226 ecr 2856082090], l
ength 180
19:37:21.818623 IP node332.40246 > node336.ssh: Flags [.], ack 542660, win 
1360, options [nop,nop,TS val 2856082090 ecr 2856082226], length 0
19:37:21.818632 IP node336.ssh > node332.40246: Flags [P.], seq 543036:543
12, ack 289, win 325, options [nop,nop,TS val 2856082226 ecr 2856082090], l
ength 376
19:37:21.818634 IP node332.40246 > node336.ssh: Flags [.], ack 542856, win 
1359, options [nop,nop,TS val 2856082090 ecr 2856082226], length 0
19:37:21.818678 IP node332.40246 > node336.ssh: Flags [.], ack 543036, win 
1358, options [nop,nop,TS val 2856082090 ecr 2856082226], length 0
19:37:21.818682 IP node336.ssh > node332.40246: Flags [P.], seq 543412:543$
08, ack 289, win 325, options [nop,nop,TS val 2856082226 ecr 2856082090], l
ength 196
19:37:21.818683 IP node332.40246 > node336.ssh: Flags [.], ack 543412, win 
1356, options [nop,nop,TS val 2856082090 ecr 2856082226], length 0
19:37:21.818702 IP node336.ssh > node332.40246: Flags [P.], seq 543608:543$
04, ack 289, win 325, options [nop,nop,TS val 2856082226 ecr 2856082090], l
ength 196
**************************

how can I solve the problem?

**Comment by whu-lyh** [comment]
@hhyasdf  hi,i have meet the same problems like these, i wander whether you have solved this problem, can you share your solution? thanks

**Comment by hhyasdf** [comment]
It maybe is because of that there is a extra firewall in CentOS except iptables, and you should have got it closed.
